{
  "artifact_type": "frame_delta_evaluation",
  "scenario_id": "batch1-07-ambiguous-governance-ask",
  "subject_ref": "examples/studio/frame-delta/scenarios/ambiguous-governance-ask-shadow.scenario.json",
  "baseline_summary": "Without shadow pressure, this ask can still be misread as harmless local cleanup even though its real pressure points toward truth-facing governance change.",
  "delta_summary": "Delta preflight marked high framing risk, challenge outcome reframed, and 1 ledger entry preserved why the benign cleanup frame looked plausible.",
  "comparison_axes": [
    {
      "axis": "misframing_detection",
      "winner": "delta",
      "reason": "Delta catches the hidden governance frame instead of remaining inside the cleanup reading."
    },
    {
      "axis": "constraint_fidelity",
      "winner": "delta",
      "reason": "Delta keeps the no-truth-mutation boundary active before any decomposition begins."
    },
    {
      "axis": "premature_closure_resistance",
      "winner": "delta",
      "reason": "Delta blocks a too-easy benign interpretation that would otherwise close the frame early."
    },
    {
      "axis": "signal_gap_awareness",
      "winner": "delta",
      "reason": "Delta surfaces the decisive unresolved question about local versus truth-facing intent."
    },
    {
      "axis": "actionability_after_challenge",
      "winner": "tie",
      "reason": "Both tracks can still produce a next step, but only Delta makes the safer reframing explicit."
    }
  ],
  "overall_result": "delta_better",
  "integration_signal": "none",
  "delta_refs": {
    "preflight_ref": "examples/studio/frame-delta/batch1/cases/07-ambiguous-governance-ask/delta-preflight.json",
    "challenge_result_ref": "examples/studio/frame-delta/batch1/cases/07-ambiguous-governance-ask/frame-challenge-result.json"
  },
  "shadow_only": true,
  "non_authoritative": true
}
